SenJohnMcCain|b'Every year, our committee reports out a bill that is debated, amended &amp; signed into law\xe2\x80\x94imperfect, full of compromises, unsatisfactory for partisans on either side, but always striving to make incremental progress on solving problems &amp; defending America her from her adversaries.'
SenJohnMcCain|b'Thanks to my #SASC colleagues\xe2\x80\x99 commitment to principled legislating, I believe the NDAA will continue to serve as an example of how the Senate can and should work.'
SenJohnMcCain|"b""My term as #SASC Chairman has been far from perfect. But I'm proud our members have upheld the Senate\xe2\x80\x99s finest traditions, embraced regular order, worked within our peculiar rules and customs, and accepted the necessity of compromise."""
SenJohnMcCain|b'I\xe2\x80\x99d also like to express my thanks to @JimInhofe for shepherding the #FY19NDAA through the committee markup in my absence this year. I am grateful for his leadership in presiding over committee hearings as well.'
SenJohnMcCain|b'I count myself fortunate to have @SenJackReed as my partner on the committee. We come from different parties &amp; we\xe2\x80\x99ve had disagreements on the issues of the day. But through it all, we have done our best to collaboratively discharge our duty to provide for the common defense.'
SenJohnMcCain|b'I\xe2\x80\x99m proud #SASC voted overwhelmingly to pass the #FY19NDAA. One of the greatest honors of my life has been to serve as the committee\xe2\x80\x99s Chairman &amp; provide for the women &amp; men in uniform who defend America and all she stands for. '
SenJohnMcCain|"b""I applaud @POTUS for issuing a posthumous pardon of boxing legend Jack Johnson for his racially charged conviction a century ago. This action finally rights a historical wrong, restores a great athlete's legacy &amp; closes a shameful chapter in our history. """
SenJohnMcCain|"b'.@ABC: ""John McCain says in new biopic: \'I\'m a human being and I\'m not a maverick\'"" '"
SenJohnMcCain|"b""I'm deeply humbled my colleagues have designated this bill in my name, along with my friend &amp; comrade, @SamsPressShop &amp; WWII veteran, the late Sen Daniel Akaka. We share this honor w/ all veterans who came before us &amp; all who proudly served &amp; are still serving around the world."""
SenJohnMcCain|b'I applaud the Senate for passing the #VAMISSIONAct, which includes major reforms I cosponsored with @JerryMoran to expand health care choices for veterans &amp; transform the VA into an integrated 21st century health care system '
SenJohnMcCain|"b'Must-read @JeffreyGoldberg @TheAtlantic: ""John McCain\xe2\x80\x99s Greatest Fear: A conversation with Mark Salter about the core tenet of the senator\xe2\x80\x99s worldview: Always speak up."" '"
SenJohnMcCain|b'Cindy &amp; I send our heartfelt prayers to Susan, Evan &amp; the entire Bayh family. We are with you in this fight &amp; confident that Susan will face this challenge with courage, hope &amp; strength. '
SenJohnMcCain|"b'.@NPR: ""In \'The Restless Wave\' Sen. John McCain Discusses Principles He Wants The U.S. To Keep"" '"
SenJohnMcCain|"b'.@CNN on my new book w/ @MarkSalter55, The Restless Wave, which is now out today: ""Speechwriter helps John McCain say his piece in \'Restless Wave\'"" '"
SenJohnMcCain|"b'.@nypost: ""This week\xe2\x80\x99s must-read books"" '"
SenJohnMcCain|"b'.@USATODAY: ""5 books you won\'t want to miss this week, including Stephen King, John McCain"" '"
SenJohnMcCain|b'My friend &amp; coauthor @MarkSalter55 joined @CBSThisMorning today to discuss our new collaboration, The Restless Wave, which hits shelves tomorrow '
SenJohnMcCain|b'Happy birthday to my extraordinary wife @cindymccain - you make us very proud! '
SenJohnMcCain|"b'Thanks to my family, friends &amp; colleagues for coming together yesterday for the premiere of the new @HBODocs ""John McCain: For Whom the Bell Tolls,"" esp. @SenateMajLdr @SenSchumer @LindseyGrahamSC &amp; @amyklobuchar. Watch the film on @HBO May 28th @ 8pm ET. '"
SenJohnMcCain|b'Happy 37th anniversary to my love @cindymccain - time flies when you\xe2\x80\x99re having fun! '
SenJohnMcCain|b'Grateful to our son Jimmy for speaking at @IRIglobal\xe2\x80\x99s #FreedomDinner tonight as Sec Mattis &amp; Amb @nikkihaley are honored w/ this year\xe2\x80\x99s Freedom Award. Congratulations &amp; thank you IRI for the work you do to spread freedom &amp; democracy across the world. '
SenJohnMcCain|b'From one cantankerous senator to another, sending my prayers &amp; best wishes to @SenatorReid as he recovers from a successful surgery'
SenJohnMcCain|"b'Must-read @Militarydotcom: ""Training Kills More Troops Than War. Here\'s What\'s Being Done About It"" '"
SenJohnMcCain|b'Happy #MothersDay to all the moms around the country &amp; the world! I\xe2\x80\x99m especially grateful for my remarkable mom Roberta &amp; my extraordinary wife @cindymccain, whose selflessness, devotion &amp; courage give our family great strength. '
SenJohnMcCain|"b'Read a new excerpt from my upcoming book in @WSJ: ""John McCain: \xe2\x80\x98Vladimir Putin Is an Evil Man\xe2\x80\x99"" '"
SenJohnMcCain|b'I believe Gina Haspel is a patriot who loves our country &amp; has devoted her professional life to its service &amp; defense. However, her role in overseeing the use of torture is disturbing &amp; her refusal to acknowledge torture\xe2\x80\x99s immorality is disqualifying. '
SenJohnMcCain|"b'Must-read @washingtonpost: ""Hear #China\xe2\x80\x99s totalitarian cruelty in this widow\xe2\x80\x99s sobs"" '"
SenJohnMcCain|"b'Must-read @nytimes: ""A Relative Wages Jack Johnson\xe2\x80\x99s Biggest Fight: To Clear His Name"" '"
SenJohnMcCain|b'Cindy &amp; I are praying for the families of the brave members of the National Guard whose lives were lost in the tragic C-130 crash in Savannah.'
SenJohnMcCain|b'Former First Lady Barbara Bush remains an example to all of us of kindness and patriotism, and will fondly be remembered for her courage, grit and intense loyalty to those she loved and cared for. Cindy and I send our prayers and condolences to the entire Bush family. '
SenJohnMcCain|b'I applaud the President for taking military action against the Assad regime, and I am grateful to our British and French allies for joining us in this action. To succeed in the long run, we need a comprehensive strategy for Syria and the entire region. '
SenJohnMcCain|b'Director Pompeo has the experience &amp; understanding needed to reassert strong American leadership, confront complex global challenges, restore morale @StateDept &amp; ensure human rights is central to diplomacy. The Senate should move quickly to confirm this highly qualified nominee.'
SenJohnMcCain|b'Today, @POTUS signed into law our bipartisan #SESTA. This bill will enable Backpage and other websites to be held accountable for knowingly facilitating human trafficking, and allow victims of these horrific crimes to seek the justice they deserve.  '
SenJohnMcCain|"b'Must-read by @DCTwining @IRIglobal &amp; @kwollack @NDI in @washingtonpost: ""#Russia\xe2\x80\x99s nefarious meddling is nothing like democracy assistance"" '"
SenJohnMcCain|b'.@SpeakerRyan is a good man who has served the country and the people of Wisconsin with honor and distinction. While his leadership in Congress will be missed, I\xe2\x80\x99m confident we will continue to see him accomplish great things in the years ahead. Job well done, Mr. Speaker!'
SenJohnMcCain|"b'Important @MilitaryTimes: ""The death toll for rising aviation accidents: 133 troops killed in five years"" '"
SenJohnMcCain|"b"".@POTUS's pledge to withdraw from #Syria has only emboldened Assad, backed by Russia &amp; Iran, to commit more war crimes in #Douma. @POTUS responded after last year's chemical attack. He should do so again &amp; make Assad pay a price for his brutality. """
SenJohnMcCain|b'The seizure of the malicious sex marketplace  marks an important step forward in the fight against human trafficking. '
SenJohnMcCain|b'It\xe2\x80\x99s easy to punish #China. It\xe2\x80\x99s a lot harder to hold it truly accountable and change its behavior. That requires a real strategy and positive trade agenda, which is why the US should rejoin the #TPP11.'
SenJohnMcCain|"b""New sanctions send a message to #Putin &amp; his cronies that there will be a high price to pay for Russian aggression. The US must press forward w/ broader strategy to counter #Russia's malign activities. """
SenJohnMcCain|b'Good news from @DeptofDefense that they intend to shock test USS Gerald R Ford. Full ship shock trials before first deployment will help address concerns w/reliability of unproven new technologies on board. SASC will continue oversight as @USNavy moves fwd '
SenJohnMcCain|b'Praying for the family &amp; friends of @AFThunderbirds pilot killed in F-16 crash in #Nevada. With more service members dying in routine training accidents than in combat, we must do everything to ensure our military has the training, equipment &amp; resources it needs.'
SenJohnMcCain|"b'Must-read @azcentral editorial: ""#RioReimagined challenges metro #Phoenix to think big. Are we ready?"" '"
SenJohnMcCain|"b""Thank you @GrandCanyonNPS @GrandCanyonAssn &amp; @dougducey for this incredible honor, which I'm proud to share with my friend, mentor &amp; hero, the legendary Mo Udall """
SenJohnMcCain|b'Cindy &amp; I send our prayers &amp; condolences to the families of the four Marines whose lives were lost in the CH-53E crash in California. The Armed Services Committee is monitoring the investigation into this tragedy closely.'
SenJohnMcCain|"b'.@TIME: ""How Poetry Helped Sustain John McCain During His Years as a Prisoner of War"" #NationalPoetryMonth '"
SenJohnMcCain|b'#RioReimagined is a grand project that will transform the Valley, enhance our communities &amp; connect all Arizonans. Read more about this vision in my @azcentral oped w/ @michaelcrow '
SenJohnMcCain|"b""Happy #DbacksOpeningDay! Here's hoping the @Dbacks have better luck fielding flies than @cindymccain &amp; I did! """
SenJohnMcCain|b'Glad to see the concerns of #Phoenix residents addressed &amp; this long-standing issue resolved. '
SenJohnMcCain|"b'Must-read from @insidedefense ""How GOP defense hawks delivered a massive military budget"" '"
SenJohnMcCain|"b'Must-read @washingtonpost: ""The #Russian expulsions are a good first step. But only a first step."" '"
SenJohnMcCain|b'On the 100th anniversary of the Republic of Belarus declaring its independence, I stand with the Belarusian people who yearn to live for freedom &amp; independence as they were promised a century ago.'
SenJohnMcCain|b'Thank you @JoeBiden for always being a true friend. It\xe2\x80\x99s a surreal honor after graduating 5th from the bottom of my class to receive the @NavalAcademy Distinguished Alumni Award. Thank you USNA &amp; the Class of 1958 for this tremendous recognition. '
SenJohnMcCain|b'Very proud the Senate passed my bill w/ @SenatorHeitkamp, named for Ashlynne Mike, to expand the AMBER Alert child abduction warning system in Indian Country so we can help victims &amp; save lives '
SenJohnMcCain|b'I sent a letter to CIA Director nominee Gina Haspel asking her to explain her role in the CIA\xe2\x80\x99s so-called \xe2\x80\x9cenhanced interrogation\xe2\x80\x9d program - read the full letter \xe2\x86\x92 '
SenJohnMcCain|b'Congrats to @MeghanMcCain &amp; @TheView on being nominated for four #DaytimeEmmys - very proud! '
SenJohnMcCain|b'Congratulations #Kosovo! An important step forward for Kosovo\xe2\x80\x99s European future. '
SenJohnMcCain|b'Thanks @senrobportman, @clairecmc, @SenBlumenthal, @JohnCornyn, @SenatorHeitkamp, our colleagues &amp; especially my wife @cindymccain for leading this important effort to #EndHumanTrafficking'
SenJohnMcCain|"b""The Senate's overwhelming, bipartisan passage of #SESTA is an imp't step forward in providing justice for victims of sex trafficking &amp; holding accountable websites like Backpage that facilitate this horrific crime. """
SenJohnMcCain|b'Saddened by the passing of Pete Peterson, a successful businessman, public servant &amp; philanthropist dedicated to raising awareness of our nation\xe2\x80\x99s fiscal challenges. RIP. '
SenJohnMcCain|b'#Nowruz greetings all those who celebrate in the US &amp; around the world, including our friends in Afghanistan, Iraq, Syria, Central Asia, the Caucasus &amp; the Black Sea region'
SenJohnMcCain|b'Today the Senate will vote on #SESTA to help #EndHumanTrafficking &amp; provide justice to victims of this heinous crime. Thanks to @senrobportman for your leadership on getting this important bill across the goal line. '
SenJohnMcCain|b'#Nowruz Mobarak to the Iranian-American community and to all Iranians around the world yearning for peace and freedom in a democratic and prosperous #Iran'
SenJohnMcCain|b'An American president does not lead the Free World by congratulating dictators on winning sham elections. And by doing so with Vladimir Putin, President Trump insulted every Russian citizen who was denied the right to vote in a free and fair election. '
SenJohnMcCain|"b""Sent letter w/ @SenatorShaheen urging USTR to support a full repeal of @USDA's wasteful &amp; duplicative catfish inspection program """
SenJohnMcCain|b'Special Counsel Mueller has served our country with honesty and integrity. It\xe2\x80\x99s critical he be allowed to complete a thorough investigation into Russia\xe2\x80\x99s interference in the 2016 election \xe2\x80\x94 unimpeded.'
SenJohnMcCain|b'That #Putin had to work so hard to drive voter turnout shows the Russian people know his claim to power is a sham. The US stands with all Russians yearning for freedom. #RussiaElections2018 '
SenJohnMcCain|b'Beautiful day on Oak Creek! #Arizona '
SenJohnMcCain|b'Cindy &amp; I are praying for the families of the service members killed in the helicopter crash in #Iraq. The Senate Armed Service Committee is monitoring the ongoing investigation closely.'
SenJohnMcCain|b'Deeply disturbed by @AP reports detailing child sexual assault on military bases. @SenJackReed &amp; I sent a letter to Sec Mattis requesting a full review of DOD policies to ensure its does everything possible to help victims &amp; rehabilitate offenders. '
SenJohnMcCain|b'The admin took an overdue step forward today in holding #Putin accountable for his brazen attack on our democracy. Now, it must work urgently to fully implement #Russia sanctions &amp; ensure #Putin pays a price. '
SenJohnMcCain|"b""Cindy &amp; I are praying for the @USNavy aviators whose lives were lost in yesterday's F-18 crash. With our men &amp; women in uniform now suffering more fatalities during training than in combat, we must do everything we can to keep them safe. """
SenJohnMcCain|"b""On the 7th anniversary of the war in #Syria, half a million people are dead, 11 million have been forced to flee their homes &amp; #Assad's slaughter continues, backed by #Russia &amp; Iran. How many more innocent people need to die before the US takes action? """
SenJohnMcCain|"b""Glad the Senate is taking up our bipartisan #SESTA thanks to the leadership of @senrobportman. It's long past time we hold accountable websites like Backpage that knowingly facilitate the trafficking of innocent women &amp; children."""
SenJohnMcCain|b'#Arizona will miss you Honey Badger - thanks for the memories! #AZCardinals '
SenJohnMcCain|b'Finished my #MarchMadness bracket - very proud #Arizona has two teams competing this year! #BearDown #ForksUp '
SenJohnMcCain|b'45 years ago today... '
SenJohnMcCain|b'Important action by PM @theresa_may to hold #Putin accountable for the chemical attack in Salisbury. The United States must stand with our ally &amp; ensure Russian authorities pay a price for their outrageous crimes. '
SenJohnMcCain|"b""Cindy &amp; I are saddened by the passing of Admiral Joe Vasey, a WWII veteran, distinguished naval leader &amp; my father's dear friend &amp; comrade. Joe's memory will be revered by a grateful nation for his constant service to a cause greater than himself. """
SenJohnMcCain|b'As we hope for the recovery of Sergei &amp; Yulia Skripal, we must recognize #Putin will not hesitate to engage in state-sponsored assassination. He must not be allowed to treat the UK or any other nation as a venue for political murder. '
SenJohnMcCain|b'The torture of detainees in U.S. custody during the last decade was one of the darkest chapters in American history. The Senate must do its job in scrutinizing the record &amp; involvement of Gina Haspel in this disgraceful program. '
SenJohnMcCain|"b""Glad to see @USArmy decide to replace DCGS program w/ commercially available capability. After $3B spent, it was time to find another way. The NDAA required Army to consider off-the-shelf products that would meet tactical requirements &amp; soldiers' needs. """
SenJohnMcCain|"b'Must-read @WSJ: ""Trade Agreements Are the Answer to Trade Deficits"" '"
SenJohnMcCain|"b'Must-read @washingtonpost: ""Is #Putin\xe2\x80\x99s poison squad back in Britain?"" '"
SenJohnMcCain|"b""Cindy &amp; I are saddened by the passing of Joe Woods, one of Mesa\xe2\x80\x99s most prominent businessmen &amp; influential civic leaders. Our prayers are with Joe's son, our dear friend, @GrantWoods &amp; his entire family. """
SenJohnMcCain|b'I write in @nytimes today with filmmaker &amp; humanitarian Angelina Jolie that America must take the lead in defending the Rohingya from atrocities &amp; human rights abuses in #Burma '
SenJohnMcCain|"b""Congratulations to Jonathan Karp, @simonschuster's new president and publisher. We\xe2\x80\x99ve done 7 books together and not one would have been worth reading without Jon\xe2\x80\x99s wise counsel. Well done, old friend. Richly deserved."""
SenJohnMcCain|b'President Trump\xe2\x80\x99s decision to impose steep tariffs on steel &amp; aluminum imports will not protect America. They will harm the American economy, hurt American workers &amp; damage relations with America\xe2\x80\x99s allies &amp; partners. '
SenJohnMcCain|b'Must-read @WSJ: \xe2\x80\x9cHow a Trade War Escalates\xe2\x80\x9d '
SenJohnMcCain|b'Must-read @WSJ: \xe2\x80\x9c#Russia\xe2\x80\x99s Trail of Poison\xe2\x80\x9d '
SenJohnMcCain|b'No US policy or strategy in #Europe can succeed without a strong #NATO alliance. We must not forget that America is safer &amp; more secure because we work with &amp; through our allies.  '
SenJohnMcCain|b'Thank you @MayorStanton for your support of the Rio Salado project! '
SenJohnMcCain|"b'Must-read @nytimes: ""Former Russian Spy Mysteriously Falls Ill in Britain. Again."" '"
SenJohnMcCain|b'Thank you @MayorStanton &amp; @CityofPhoenixAZ for leading an interagency initiative to combat military &amp; veteran suicide. More progress can be made if we replicate the #Arizona Be Connected program nationwide. '
SenJohnMcCain|b'Today\xe2\x80\x99s historic port call by the USS Carl Vinson in #Vietnam underscores the enormous progress the United States &amp; Vietnam have made in transcending the wounds of war &amp; building a close partnership.  '
SenJohnMcCain|"b'Important @NickKristof @nytimes read: ""I Saw a Genocide in Slow Motion: Myanmar continues to kill its #Rohingya, now by denying them health care and sometimes food instead of by wielding machetes and firing bullets"" '"
SenJohnMcCain|"b'Must-read @hiattf @washingtonpost: ""Putin and Sissi are putting on elections. Why bother?"" '"
SenJohnMcCain|"b'Must-read @washingtonpost: ""The U.N. human rights commissioner says \xe2\x80\x98shame is in retreat.\xe2\x80\x99 He\xe2\x80\x99s right."" '"
SenJohnMcCain|b'The work of @NEDemocracy @IRIglobal &amp; @NDI to foster the infrastructure of democracy\xe2\x80\x94freedom of the press, political parties &amp; rule of law\xe2\x80\x94is invaluable. Congress must continue to fund these important institutions. '
SenJohnMcCain|b'Must-read @BretStephensNYT @nytopinion: \xe2\x80\x9cThe Rise of Dictatorship Incorporated\xe2\x80\x9d '
SenJohnMcCain|b'Beautiful warm day in #Sedona with @cindymccain! '
SenJohnMcCain|b'The President\xe2\x80\x99s sweeping tariffs will only serve to hurt American workers and consumers, and alienate us from our most important allies and trading partners. '
SenJohnMcCain|"b'Great watching @cindymccain &amp; @MeghanMcCain on @TheView @ABC today! ""We need more compassion, we need more empathy, we need more togetherness."" '"
SenJohnMcCain|b'Looking forward to watching @cindymccain &amp; @MeghanMcCain on @TheView @ABC today - be sure to tune-in!'
SenJohnMcCain|b'Tonight the House passed our bill to provide justice to victims of online sex trafficking &amp; hold all enablers of this monstrous crime accountable. I urge the Senate to quickly take up &amp; pass this bill. #SESTA '
SenJohnMcCain|b'3 yrs after Boris Nemtsov\xe2\x80\x99s murder, the street outside the Russian Embassy was named in his honor. The greatest memorial to Boris will be a free Russia. Until then, America will gladly pay tribute to Boris &amp; the millions of Russians who share his vision.  '
SenJohnMcCain|b'Last night, the House passed my bill w/ @SenatorHeitkamp named for Ashlynne Mike, an 11 yr old Navajo girl who was abducted &amp; murdered in 2016. Our bill will expand the AMBER Alert system to Indian Country to ensure tribes have the tools to prevent future tragedies &amp; save lives. '
SenJohnMcCain|b'#Kremlin trolls are at it again! '
SenJohnMcCain|"b'Must-read @nytimes: ""U.N. Links #NorthKorea to #Syria\xe2\x80\x99s Chemical Weapon Program"" '"
SenJohnMcCain|b'I joined @SenatorWicker yesterday in cosponsoring a bill to help @USNavy restore its surface force readiness so we can keep our military safe in peace &amp; effective in combat '
SenJohnMcCain|b'America must fight for universal values, rule of law, open commerce &amp; respect for sovereignty. If we don\xe2\x80\x99t, who will? Certainly not a dictator for life\xe2\x80\xa6 '
SenJohnMcCain|"b'Important @washingtonpost read: ""#Burma is bulldozing history and memory"" '"
SenJohnMcCain|b'Must-read @washingtonpost: \xe2\x80\x9cA death in an Iranian prison is one more shocking sign of repression\xe2\x80\x9d '
SenJohnMcCain|"b""Cindy &amp; I enjoyed a wonderful visit yesterday with our friend, @AZCardinals legend @LarryFitzgerald. We're grateful for your friendship &amp; outstanding leadership on and off the field! """
SenJohnMcCain|b'Must-read tribute to Billy Graham by President George W Bush: \xe2\x80\x9cHow Billy Graham Changed My Life\xe2\x80\x9d '
SenJohnMcCain|b'#Assad\xe2\x80\x99s continued slaughter in #Syria - backed by #Russia &amp; #Iran - is appalling, yet unsurprising given years of brutality. What\xe2\x80\x99s shocking is the admin still has no strategy to change course. The deadline Congress imposed for that strategy has come and gone. We must do better.'
SenJohnMcCain|b'Saddened by the passing of Rev. Billy Graham, a great American &amp; faithful Christian who inspired millions of people with the gospel message. RIP.'
SenJohnMcCain|b'Thank you @MunSecConf for honoring me this weekend. I am counting on all of you to be brave, to be useful, to keep the faith, and to never, ever stop fighting for all that is good, and just, and decent about our world, and each other. #MSC2018 '
SenJohnMcCain|"b'Must-read @WSJ: ""Elon Musk Impresses #China"" '"
SenJohnMcCain|"b""Thank you @MunSecConf, @JoeBiden &amp; @ischinger for honoring me with the Ewald von Kleist Award. It breaks my heart I couldn't be at #MSC2018, but my wonderful wife @cindymccain attended &amp; delivered an important message. Read it here:  """
SenJohnMcCain|"b""Today's indictments also underscore the urgent need to strengthen cyber defenses, safeguard our election system &amp; maintain sanctions pressure on #Putin. There must be a high price for attacking America. """
SenJohnMcCain|b'.@MittRomney has shown the country what it means to lead with honor, integrity and civility. The people of #Utah and the nation need his strong voice, resolve and service now more than ever.'
SenJohnMcCain|b'Thrilled #Arizona will get to watch @LarryFitzgerald lead the @AZCardinals next season - us old geezers have to stick together! #BirdGang'
SenJohnMcCain|b'Cindy &amp; I are praying for all those impacted by the senseless shooting at Stoneman Douglas High School in #Florida. Our hearts are with the victims, their families, all first responders &amp; the entire Parkland community.'
SenJohnMcCain|b'Happy 106th birthday #Arizona - how blessed we are to live in this blessed, bountiful, beautiful state! '
SenJohnMcCain|b'Happy #ValentinesDay to my valentine @cindymccain! '
SenJohnMcCain|"b'Excellent piece by @RHFontaine @CNASdc &amp; @DCTwining @IRIglobal in @ForeignPolicy today - a must-read: ""Defending America Means Defending Democracy"" '"
SenJohnMcCain|"b""Tune-in to @SASCMajority's hearing on @DeptofDefense's role in protecting democratic elections, happening now: """
SenJohnMcCain|"b'Must-read @washingtonpost: ""#Russia is betting it can push the U.S. out of #Syria. That would be devastating."" '"
SenJohnMcCain|b'Congrats @LarryFitzgerald! '
SenJohnMcCain|b'I continue to have concerns with the reliability of unproven new technologies on the Ford-class carrier. Full ship shock trials would help address these issues &amp; Sec Mattis should ensure these tests take place before the first deployment.\n'
SenJohnMcCain|b'The #BudgetDeal finally makes good on our promise to provide for the men &amp; women who so faithfully serve our nation in uniform. '
SenJohnMcCain|"b'Must-read op-ed by #Estonia Pres @KerstiKaljulaid in @WSJ today: ""The Baltic States Turn 100"" '"
SenJohnMcCain|"b'Good @nytimes read today: ""The Mystery of Hanoi Hannah"" '"
